{
  "$schema": "https://storyvisualizer.local/schemas/lora-resource.schema.json",
  "version": 2,
  "id": "lora-bc6c64c1d6609d66",
  "name": "akipeko | Style",
  "kind": "lora",
  "created_at": "2026-08-21T14:14:32.866Z",
  "updated_at": "2026-08-21T14:45:43.902Z",
  "file": {
    "relative_path": "loras/civitai-anima/2647503-2972746-akipekoanima_v1_1-step00003000.safetensors",
    "sha256": "bc6c64c1d6609d662b6e673e2d4c11cfc37ec1bd229be2fbf38c5485b3a3d03b",
    "size_bytes": 132308976
  },
  "architecture": {
    "family": "anima",
    "prompt_family": "anima"
  },
  "base_models": [
    {
      "kind": "base_model",
      "name": "Anima",
      "identity_status": "declared",
      "relative_path": null,
      "sha256": null,
      "size_bytes": null,
      "source": "https://civitai.com/models/2647503?modelVersionId=2972746"
    }
  ],
  "concept": {
    "name": "akipeko | Style",
    "description": "Takedown requests can be submitted via Twitter at @AkioA_I\n\n削除依頼はTwitter（@AkioA_I）まで提出可能です。\n\nTHIS IS ANIMA, NOT ILLUSTRIOUS OR NOOBAI! It is a different model and it won't work on those checkpoints/models!"
  },
  "activation": {
    "trigger_words": [
      "@akipekostyle"
    ],
    "tags": [
      "cute",
      "style",
      "girls",
      "anime",
      "women"
    ]
  },
  "recommended_generation": {
    "weight": {
      "default": null,
      "minimum": null,
      "maximum": null,
      "status": "untested"
    },
    "clip_skip": null,
    "sampler": null,
    "scheduler": null,
    "steps": null,
    "cfg": null,
    "status": "untested"
  },
  "training": null,
  "description": "Takedown requests can be submitted via Twitter at @AkioA_I\n\n削除依頼はTwitter（@AkioA_I）まで提出可能です。\n\nTHIS IS ANIMA, NOT ILLUSTRIOUS OR NOOBAI! It is a different model and it won't work on those checkpoints/models!",
  "usage_notes": "以下推荐信息来自 Civitai 选定版本及其模型发布说明；本机尚未对参数做实测，因此资源状态仍为 untested。\n页面强调这是 Anima LoRA，不适用于 Illustrious 或 NoobAI；未明确权重或采样参数。\n本次保存 3 张 Civitai 发布图；不使用 nsfw=None 过滤。图片级 nsfwLevel：131669076:1, 131669089:1, 131669105:1。",
  "license": {
    "type": "civitai_model_permissions",
    "allow_no_credit": true,
    "allow_commercial_use": [
      "RentCivit"
    ],
    "allow_derivatives": true,
    "allow_different_license": true
  },
  "source": {
    "type": "civitai",
    "url": "https://civitai.com/models/2647503?modelVersionId=2972746",
    "civitai_model_id": 2647503,
    "civitai_version_id": 2972746,
    "version_name": "Anima Based V1"
  },
  "previews": [
    {
      "id": "preview-001",
      "file": "previews/preview-001.jpg",
      "alt": "akipeko | Style · Anima Based V1 Civitai 发布图 1",
      "source": "https://civitai.com/images/131669076",
      "nsfw_level": 1
    },
    {
      "id": "preview-002",
      "file": "previews/preview-002.jpg",
      "alt": "akipeko | Style · Anima Based V1 Civitai 发布图 2",
      "source": "https://civitai.com/images/131669089",
      "nsfw_level": 1
    },
    {
      "id": "preview-003",
      "file": "previews/preview-003.jpg",
      "alt": "akipeko | Style · Anima Based V1 Civitai 发布图 3",
      "source": "https://civitai.com/images/131669105",
      "nsfw_level": 1
    }
  ],
  "examples": [],
  "embedded_metadata": {
    "role": "backup",
    "values": {
      "civitai.model_id": "2647503",
      "civitai.version_id": "2972746",
      "civitai.version_name": "Anima Based V1",
      "civitai.creator": "AkioAI",
      "civitai.base_model": "Anima",
      "civitai.file_name": "akipekoanima_v1_1-step00003000.safetensors",
      "civitai.file_sha256": "bc6c64c1d6609d662b6e673e2d4c11cfc37ec1bd229be2fbf38c5485b3a3d03b",
      "civitai.file_size_kb": "129207.984375",
      "civitai.trained_words": "[\"@akipekostyle\"]",
      "civitai.model_tags": "[\"cute\",\"style\",\"girls\",\"anime\",\"women\"]",
      "civitai.version_created_at": "2026-05-24T09:47:26.516Z",
      "civitai.version_published_at": "2026-05-24T10:01:15.030Z",
      "civitai.preview_source": "https://civitai.com/images/131669076",
      "civitai.preview_images": "[{\"id\":\"131669076\",\"nsfw_level\":1,\"source\":\"https://civitai.com/images/131669076\"},{\"id\":\"131669089\",\"nsfw_level\":1,\"source\":\"https://civitai.com/images/131669089\"},{\"id\":\"131669105\",\"nsfw_level\":1,\"source\":\"https://civitai.com/images/131669105\"}]",
      "civitai.recommendation_source": "https://civitai.com/models/2647503?modelVersionId=2972746"
    }
  },
  "name_zh": "akipeko 画风",
  "summary_zh": "引入 akipeko 的插画风格。",
  "purpose": "画风"
}
